Item Name,Item Description,Category,Value,DonorPrefix,DonorFirst,DonorLast,DonorOrg,DonorDisplay,Restrictions
Mark Hopkins Hotel Two-night Stay,Spend two luxurious nights at the historic Mark Hopkins Hotel in San Francisco,Travel / Vacations,1000,Ms.,Bently,Doright,N/A,Ms. Bently Doright,Must be 18 years or older
$500 Gift Certificate to Mira Loma Day Spa,Enjoy five massages or any other combination of our exclusive services.,Lifestyle,500,Ms.,Amy,Anderson,Mira Loma Day Spa,Mira Loma Day Spa,Must be 18 years or older
Seven Nights Tahoe Luxury Cabin,Enjoy seven wonderful nights at our gorgeous Squaw Valley cabin.,Travel / Vacations,3000,Mr. and Mrs.,David,Dreyer,N/A,Mr. and Mrs. David Dreyer,Must be at least one adult present at all times
1993 Chateau Lafitte Rothschild Bordeaux - One Case,Spectacular!   The best vintage of the entire 1990's in France's famed Bordeaux wine region!,Food & Drink,2000,Mr.,James,Buckner,BevMo!,BevMo!,Must be 21 years or older
"Dinner for Six at Plumed Horse, Saratoga",Fabulous dinner for six guests at the famous Plumed Horse Restaurant in Saratoga,Food & Drink,2000,Ms.,Jennifer,Jones,Plumed Horse Restaurant,Plumed Horse Restaurant,None
